theorem_id,severity,weakest_step,disposition,status,owner,closure_evidence
T1,critical,Boundary reachability remains domain-specific and battery-scoped.,pending_external_review,pending_external_review,external_review_owner_pending,pending_external_review_artifact
T2,critical,The absorbed tightening must match the runtime FTIT/shield implementation exactly.,pending_external_review,pending_external_review,external_review_owner_pending,pending_external_review_artifact
T3a,critical,The theorem is only as good as the runtime-to-risk bridge.,pending_external_review,pending_external_review,external_review_owner_pending,pending_external_review_artifact
T4,high,The constructive witness is intentionally class-scoped.,pending_external_review,pending_external_review,external_review_owner_pending,pending_external_review_artifact
T6,high,Multiple legacy horizon helpers existed before the canonical delta-aware helper.,pending_external_review,pending_external_review,external_review_owner_pending,pending_external_review_artifact
T7,high,The promoted surface is intentionally battery-specific and only covers piecewise hold-or-safe-landing fallback semantics.,pending_external_review,pending_external_review,external_review_owner_pending,pending_external_review_artifact
T8,medium,The helper proves comparison for supplied paired sequences only.,pending_external_review,pending_external_review,external_review_owner_pending,pending_external_review_artifact
T11,critical,The theorem is forward-only at the active surface.,pending_external_review,pending_external_review,external_review_owner_pending,pending_external_review_artifact
T_trajectory_PAC,high,The certificate is conservative by design because it stacks finite-sample and worst-case reliability corrections.,pending_external_review,pending_external_review,external_review_owner_pending,pending_external_review_artifact
