prior_work_family,primary_object,where_it_stops,orius_delta,repo_artifact
standard_conformal_prediction,prediction sets with marginal coverage under exchangeability,"does not decide tightened admissible actions, repaired actuation, fallback burden accounting, or release certificate semantics",uses calibration only as one stage inside a typed release-boundary runtime layer,reports/publication/three_domain_grouped_coverage.csv
adaptive_conformal_prediction,online interval adaptation under non-stationarity,"does not bind reliability scoring to tightened admissible actions, fallback burden accounting, and release governance",turns degraded observation into a governed runtime release contract rather than a pure interval update rule,reports/publication/three_domain_reliability_calibration.csv
runtime_monitoring_and_supervisory_veto,"alarms, anomaly flags, or veto conditions around candidate execution","stops at alarms or vetoes unless paired with tightened action computation, repaired release, and release governance","treats monitoring as the opening move in a typed runtime layer that still must tighten, repair, fallback, and certify",reports/publication/three_domain_runtime_safety_tradeoff.csv
runtime_assurance_simplex,supervisory intervention and fallback around a nominal controller,typically assumes the observed state is already safe enough to supervise and does not define reliability-conditioned tightening or cross-domain contract reuse,"centers degraded observation itself and carries reliability, tightening, repair, fallback, and certificate semantics together",reports/publication/three_domain_runtime_safety_tradeoff.csv
safety_filters_barrier_methods_robust_mpc,constraint-preserving repair or safe action geometry,"does not by itself define degraded-observation release governance, fallback burden accounting, certificate semantics, or cross-domain contract reuse",hosts repair inside a typed runtime grammar that begins with observation reliability and ends in governed release,reports/publication/three_domain_ablation_matrix.csv
anomaly_detection_and_drift_detection,detect degraded telemetry or distribution shift,detects loss of trust but stops at alarms or scores unless paired with repaired release semantics,treats detection as the opening move in a five-stage runtime release protocol,reports/publication/what_orius_is_not_matrix.csv
generic_uncertainty_estimation,score confidence or predictive uncertainty,"does not provide repaired action, fallback burden accounting, or certificate-aware release","binds uncertainty to action tightening, repair, fallback, and claim-locked runtime evidence",reports/publication/three_domain_ml_benchmark.csv
