dimension,current_baseline_score,target_score,current_status,implemented_lift,remaining_blocker,acceptance_gate
core_idea_novelty,82,95,pass,"Source-backed novelty separation across runtime assurance, coverage-aware uncertainty, safety-critical control, clinical validation, AV simulation, and battery HIL tiers.","Need final paper text to keep ORIUS framed as a unified observation-reliability release contract, not a predictor/filter/fallback-only system.",Reviewer can identify the exact gap ORIUS closes relative to each source lane.
theory,78,95,pass,"T4/T9/T10/T11 bridge is represented as necessity plus Bayes lower bound plus covered alpha upper bound with mechanized kernels, empirical T9/T10 discharge artifacts, and executable observation-ambiguity witnesses.",Keep T9/T10 assumption-qualified and prevent any global-optimality or all-ambiguity-implies-violation overclaim beyond the discharged Battery/AV/Healthcare boundary-law artifacts.,"T4, T11, and T10_T11_ObservationAmbiguitySandwich stay synchronized across audit, registry, code, tests, paper, and appendix."
three_domain_runtime_evidence,86,95,pass,"Runtime-denominator TSVR, fallback/intervention, calibration, witness rows, and fail-safe-normalized utility dominance are source-locked per domain.","Keep AV and Healthcare utility-safety frontiers explicit in the paper so conservative fallback is reported as a measured cost, not hidden utility success.",All promoted rows pass strict runtime gates and fail-safe-normalized utility/fallback tradeoffs are explicit.
external_validation_depth,72,95,blocked,"Current package separates bounded nuPlan closed-loop planner evidence, retrospective healthcare source/site holdout, and battery software-HIL evidence from stronger future tiers.",Complete prospective/live healthcare validation and physical or high-fidelity battery HIL; AV remains bounded nuPlan closed-loop rather than road deployment or CARLA.,No paper claim uses next-tier validation language before the corresponding artifact exists.
reproducibility_and_freeze,80,95,pass,Package marks max freeze incomplete until release manifest and hash locks exist.,"Finish max freeze, remove AppleDouble/git hygiene noise, run clean full pytest with mutation guard, and publish frozen hashes.",predeployment_release_manifest.json plus frozen hash CSV/JSON exist and validators pass.
claim_quality,88,95,pass,"All source-backed language is bounded predeployment validation and explicitly rejects road, clinical, and unrestricted field deployment claims.","Keep manuscript, README, claim ledger, and package synchronized after every new validation run.",Claim validators reject deployment overclaims and validation-harness headline evidence.
