subsystem,repo_surface_or_monograph_unit,closest_literature_family,current_maturity,battery_specific_leakage,universal_requirement,thesis_framing_action,code_or_spec_cleanup_action
telemetry_ingestion,dc3s adapters and domain parsers,cps_security_and_resilience,implemented,energy telemetry still dominates examples in some docs,domain-neutral observation packet with adapter-specific parsing,frame telemetry ingestion as a shared observation packet plus domain parsers,document canonical adapter contract and per-domain parser responsibilities
reliability_and_drift,dc3s quality and OQE paths,drift_and_anomaly_detection,implemented,example fault language can still be battery-shaped,shared reliability score across fault families,write OQE as a universal degraded-observation detector,keep battery fault examples in domain sections only
uncertainty_construction,"universal_theory, calibration, RAC/FTIT",conformal_prediction,implemented_with_bounded_assumptions,SOC-tube language leaks into universal prose in legacy files,observation-consistent state set and reliability-conditioned inflation,rename universal prose around state sets and margins,keep battery helper exports out of the universal package root
safe_action_tightening_and_repair,dc3s shield and domain adapters,shielding_and_runtime_safety,implemented,charge-discharge examples dominate some repair descriptions,domain-specific feasible set under shared repair semantics,describe repair as a general action projection,keep battery-specific repair operators inside domain modules
certificate_generation,universal_theory certificates and CertOS certificate engine,runtime_assurance,implemented,battery fields historically shaped examples,causal safety certificate with domain-neutral required fields,describe the certificate as a universal audit object,continue shifting policy checks away from SOC/MWh assumptions
runtime_governance_and_audit,CertOS runtime and lifecycle surfaces,runtime_assurance,implemented_with_cleanup_open,legacy config fields still mention SOC/MWh in some docs,policy-driven governance surface and invariant semantics,frame runtime governance as a bounded universal layer,finish replacing battery-specific invariants in docs/tests and emphasize policy hooks
benchmark_replay_and_metrics,ORIUS-Bench universal replay and metrics,benchmark_discipline,implemented_with_cleanup_open,legacy SOC fields remain for compatibility,domain-neutral benchmark schema and canonical metric family,write TSVR/OASG as universal metrics only,keep compatibility fields non-canonical and document deprecation
multi_agent_composition,shared-constraint composition scenarios,compositional_safety,bounded_extension,shared-resource examples remain feeder-centric,resource-budget composition beyond energy,"describe composition as bounded shared-constraint coordination, not a universal theorem",document vector-budget generalization path
dashboard_and_reporting,frontend api proxies and research router,artifact_governance,implemented_with_cleanup_open,older local-cache assumptions still exist in narrative and some tools,backend-served tracked artifacts only,frame the dashboard as an artifact browser rather than a local cache,keep frontend routes proxy-only and continue removing local authority language
